{
  "schemaVersion": "1.0",
  "modelVersion": "1.0.0",
  "strategy": "ATOMIC_CONDITIONAL_RESERVATION",
  "initialUnits": 1,
  "reservations": [
    { "id": "a", "quantity": 1 },
    { "id": "b", "quantity": 1 }
  ],
  "schedule": [
    { "id": "read-a", "reservationId": "a", "action": "READ" },
    { "id": "read-b", "reservationId": "b", "action": "READ" },
    { "id": "attempt-a", "reservationId": "a", "action": "ATTEMPT_RESERVE" },
    { "id": "attempt-b", "reservationId": "b", "action": "ATTEMPT_RESERVE" }
  ]
}
